title,content,username,keywords,likes,dislikes,type,date_posted,post_id
First Post,We can add posts now,user,,0,0,standard,11/23/2023,0
Thank You,I'd like to thank everyone who worked on this project,admin,,0,0,standard,11/23/2023,1
Final Big Post Update,Posts now display user images and individual posts can be viewed,test001,newfeature,0,0,standard,11/24/2023,3
Bootstrap,Graphic Design is my passion,rockyrockz95,artistic,0,0,standard,11/24/2023,5
Sobbing in the Club,:'(,user,,0,0,standard,11/26/2023,96
LEON?!?,11037,user,dang,0,0,standard,11/26/2023,213
Added Key Words,Each post should have up to 3,rockyrockz95,NewFeature,0,0,standard,11/26/2023,240
Fake Post,I am a real person,real,AI,0,0,standard,11-27-2023,235
